medcode,readcode,readterm,minormalformation,subgroup
99786,14av.00,history of ventricular septal defect,,Heart
102408,14h..00,never had mammogram,,Other
20838,14h..00,h/o: congenital anomaly,,Other
18820,14h1.00,h/o: cardiac anomaly,,Heart
17175,14h1.11,h/o: heart anomaly,,Heart
21043,14h2.00,h/o: cleft palate,,Orofacial Clefts
17207,14h3.00,h/o: cleft lip,,Orofacial Clefts
16812,14h4.00,h/o: urinary anomaly,,Urinary
4804,14h5.00,h/o: cong. dislocation - hip,,Limb
30344,14hz.00,h/o: congenital anomaly nos,,Other
104307,2126800,ostium secundum atrial septal defect resolved,,Heart
104345,24m..00,spontaneous closure of ventricular septal defect,,Heart
19532,2bb4.00,o/e - retinal microaneurysms,,Eye
45743,33b8.00,detection of cardiac shunt,,Heart
7588,66g..00,allergic disorder monitoring,,Heart
72576,66g..00,congenital heart condition monitoring,,Heart
98265,7010111,insertion of halber valve for spina bifida,,Nervous System
29739,7031000,repair of meningoencephalocele,,Nervous System
5307,7043100,closure of spinal myelomeningocele,,Nervous System
29633,7043200,closure of spinal meningocele,,Nervous System
50672,7043y00,other specified repair of spina bifida,,Nervous System
62742,7043z00,repair of spina bifida nos,,Nervous System
86022,7131900,excision of accessory breast tissue,,Other
7797,7136800,excision of accessory nipple,Yes,Other
46751,7204a00,correction of hypertelorism with orbital osteotomies,Yes,Other
108261,7204b00,corr hypertelorism c orbital osteotomies+facial bipartition,Yes,Other
95400,7204c00,corr hypertelorism c orbital osteotomies+nasal reconstruct,Yes,Other
43356,7204d00,correction of hypotelorism with orbital osteotomies,Yes,Other
40989,7255411,insertion molteno implantation tube in anterior chamber eye,,Eye
39050,7258600,excision of pupillary membrane,,Eye
65079,7259000,needling of bleb following glaucoma surgery,,Eye
89934,7259100,injection of bleb following glaucoma surgery,,Eye
88595,7259200,revision of bleb nec following glaucoma surgery,,Eye
91442,7259300,removal of releasable suture following glaucoma surgery,,Eye
93967,7259400,laser suture lysis following glaucoma surgery,,Eye
88142,7259y00,other specified operations following glaucoma surgery,,Eye
95852,7259z00,operations following glaucoma surgery nos,,Eye
4832,7300200,excision of preauricular abnormality,Yes,"""Ear, Face & Neck"""
8252,7302200,pinnaplasty,Yes,"""Ear, Face & Neck"""
6453,7302211,bat ear pinnaplasty,Yes,"""Ear, Face & Neck"""
1176,7302212,correction of prominent ear,Yes,"""Ear, Face & Neck"""
52654,7302213,mustarde pinnaplasty,Yes,"""Ear, Face & Neck"""
25476,7302214,revision pinnaplasty,Yes,"""Ear, Face & Neck"""
36354,7306100,reconstruction of external auditory canal,,"""Ear, Face & Neck"""
53456,7306111,pattee reconstruction of external auditory canal,,"""Ear, Face & Neck"""
108732,7308000,insertion of fixtures for auricular prosthesis stage 1,,"""Ear, Face & Neck"""
108733,7308100,insertion of fixtures for auricular prosthesis stage 2,,"""Ear, Face & Neck"""
94199,7308300,attention to fixtures for auricular prosthesis,,"""Ear, Face & Neck"""
39741,7406200,correction of congenital atresia of choana,,Respiratory
21363,7409000,primary correction of cleft lip nasal deformity,,Orofacial Clefts
28600,7409011,primary correction of alar cartilage,,Orofacial Clefts
70876,7409013,pigott alar leap-frog correction,,Orofacial Clefts
49350,7409100,secondary correction of cleft lip nasal deformity,,Orofacial Clefts
48195,7409111,secondary correction of alar slump,,Orofacial Clefts
105377,7409113,skoog correction of alar slump,,Orofacial Clefts
45229,7409114,dibbell correction of alar slump,,Orofacial Clefts
63658,7409200,correction of cleft lip nasal tip deformity,,Orofacial Clefts
62304,7409211,alar base advancement,,Orofacial Clefts
51498,7409300,columella lengthening procedure unspecified,,Orofacial Clefts
72318,7409400,unilateral columella lengthening operation,,Orofacial Clefts
34175,7409411,tajima unilateral columella lengthening operation,,Orofacial Clefts
8002,7409500,rhinoplasty for cleft lip nasal deformity,,Orofacial Clefts
49874,7409600,septorhinoplasty for cleft lip nasal deformity,,Orofacial Clefts
32465,7409700,septoplasty for cleft lip nasal deformity,,Orofacial Clefts
16221,7448100,excision of cyst of bronchus,,Respiratory
2020,7502.11,repair of cleft lip operations,,Orofacial Clefts
24102,7502000,"primary closure of cleft lip, unspecified",,Orofacial Clefts
69871,7502011,lemesurier cleft lip repair,,Orofacial Clefts
34071,7502012,millard cleft lip correction,,Orofacial Clefts
60496,7502014,tenison cleft lip repair,,Orofacial Clefts
24026,7502100,revision of primary closure of cleft lip,,Orofacial Clefts
21245,7502300,unilateral lip adhesion,,Orofacial Clefts
62102,7502400,bilateral lip adhesion,,Orofacial Clefts
65866,7502500,repair of unilateral cleft lip using straight line technique,,Orofacial Clefts
65664,7502600,repair unilat cleft lip - rotation advancement flp technique,,Orofacial Clefts
56520,7502611,millard repair unilateral cleft lip,,Orofacial Clefts
49751,7502700,repair of unilateral cleft lip with triangular flap,,Orofacial Clefts
110201,7502712,skoog repair unilateral cleft lip,,Orofacial Clefts
96645,7502713,tennyson repair unilateral cleft lip,,Orofacial Clefts
69454,7502800,repair unilateral cleft lip with quadrilateral flap,,Orofacial Clefts
100946,7502811,repair unilateral cleft lip with quadrilateral flap,,Orofacial Clefts
23739,7502900,repair of unilateral cleft lip unspecified,,Orofacial Clefts
103535,7502a00,repair bilateral cleft lip - rotation advancement flap tech,,Orofacial Clefts
23714,7502a11,rep bilat cleft lip millard,,Orofacial Clefts
98506,7502b00,repair of bilateral cleft lip with quadrilateral flap,,Orofacial Clefts
42525,7502c11,manchester bilateral cleft lip repair,,Orofacial Clefts
54973,7502c12,veau type iii bilateral cleft lip repair,,Orofacial Clefts
14974,7502d00,repair of bilateral cleft lip unspecified,,Orofacial Clefts
58977,7502f00,asynchronous bilateral cleft lip repair,,Orofacial Clefts
3679,7523100,incision of frenulum of tongue,Yes,Digestive
37760,7523111,frenotomy of tongue,Yes,Digestive
5032,7523112,release of tongue tie,Yes,Digestive
38085,7523200,freeing of adhesions of tongue,,Digestive
16090,7523400,excision of frenulum of tongue,Yes,Digestive
60456,7523500,glossopexy,,Digestive
36752,7525.11,repair of deformity of palate,,Other
6341,7525.12,repair of cleft palate,,Orofacial Clefts
1679,7525000,"primary repair of cleft palate, unspecified",,Orofacial Clefts
90923,7525011,kilner repair of cleft palate,,Orofacial Clefts
23683,7525012,langenbeck repair of cleft palate,,Orofacial Clefts
65948,7525013,wardill repair of cleft palate,,Orofacial Clefts
20542,7525100,revision of repair of cleft palate,,Orofacial Clefts
65887,7525200,repair cleft hard palate post based axial transposition flap,,Orofacial Clefts
99908,7525212,wardill repair cleft palate,,Orofacial Clefts
54974,7525213,veau flap repair cleft palate,,Orofacial Clefts
31584,7525300,repair of cleft hard palate with bipedicled flaps,,Orofacial Clefts
71457,7525311,langenbeck repair cleft palate,,Orofacial Clefts
37079,7525400,repair of cleft soft palate with z-plasty,,Orofacial Clefts
51058,7525411,furlow repair cleft palate,,Orofacial Clefts
34024,7525500,repair of anterior cleft palate with local flap,,Orofacial Clefts
47845,7525600,repair of anterior cleft palate with vomerine flap,,Orofacial Clefts
30249,7525700,repair of cleft soft palate with intra-velar veloplasty,,Orofacial Clefts
37071,7525711,rep anterior cleft palate local flap,,Orofacial Clefts
48749,7525712,plastic repair palate mucosal graft,,Other
51196,7525800,repair cleft soft palate with other musculature correction,,Orofacial Clefts
48646,7525y00,other specified correction of deformity of palate,,Other
41002,7525z00,correction of deformity of palate nos,,Other
33654,7606000,closure of tracheooesophageal fistula,,Digestive
92822,7606011,excision of tracheooesophageal fistula,,Digestive
58583,7606100,closure of fistula of oesophagus nec,,Digestive
43818,7606200,correction of congenital atresia of oesophagus,,Digestive
59013,7607000,exteriorisation of pouch of oesophagus,,Digestive
34229,7608200,division of web of oesophagus,,Digestive
89035,760d400,fibreoptic endoscopic dilation of web of oesophagus,,Digestive
93429,760g400,dilation of web of oesophagus using rigid oesophagoscope,,Digestive
8270,760k.00,repair of diaphragmatic hernia,,Digestive
18664,760k.11,repair of oesophageal hiatus hernia,Yes,Digestive
1178,760k.12,repair of hiatus hernia,Yes,Digestive
20114,760k000,repair of oesophageal hiatus using thoracic approach,Yes,Digestive
47416,760k011,allison repair of oesophageal hiatus hernia,Yes,Digestive
94728,760k012,mason repair of oesophageal hiatus hernia,Yes,Digestive
63539,760k100,repair of diaphragmatic hernia using thoracic approach nec,,Digestive
56512,760k200,repair of oesophageal hiatus using abdominal approach,Yes,Digestive
30980,760k300,repair of diaphragmatic hernia using abdominal approach nec,,Digestive
72571,760k400,boerema repair of hiatus hernia,Yes,Digestive
22845,760k500,laparoscopic repair of hiatus hernia,Yes,Digestive
60094,760ky00,other specified repair of diaphragmatic hernia,,Digestive
37471,760kz00,repair of diaphragmatic hernia nos,,Digestive
61616,760l312,hill repair of hiatus hernia and gastropexy,Yes,Digestive
39917,761b100,repair of congenital atresia of pylorus,,Digestive
3506,7641000,excision of meckel diverticulum,Yes,Digestive
21059,7726y11,duhamel hirschsprung abdoperin,,Digestive
68527,7726y12,soave endorectal pull through op for hirschsprung's disease,,Digestive
48226,7726y13,swenson hirschsprung proctect,,Digestive
33725,7733300,reanastomosis rectum-anal canal correct cong rectal atresia,,Digestive
93912,7838000,division of annular pancreas,,Digestive
12844,7902.11,repair of tetralogy of fallot,,Heart
16538,7902000,correct fallot tetralogy- valved right ventr outflow conduit,,Heart
73029,7902100,correct fallot tetralogy- right ventric outflow conduit nec,,Heart
99198,7902200,correct fallot tetralogy- right ventricular outflow patch,,Heart
70857,7902300,revision of correction of tetralogy of fallot,,Heart
88842,7902400,repair of tetralogy of fallot using transannular patch,,Heart
88479,7902500,repair of tetralogy of fallot with absent pulmonary valve,,Heart
93719,7902600,repair fallot-type pulmonary atresia aortopulmonary collater,,Heart
65401,7902y00,other specified correction of tetralogy of fallot,,Heart
19956,7902z00,correction of tetralogy of fallot nos,,Heart
108402,7902z11,repair of tetralogy of fallot nos,,Heart
31085,7903.11,mustard interatrial tr venous return,,Heart
37987,7903.12,senning correction for transposition of great vessels,,Heart
89968,7903.13,atrial inversion operations for transposition of great art,,Heart
62470,7903000,atrium reconstruction atrial patch for transpos great vessel,,Heart
69021,7903100,atrium reconstruction atrial wall for transpos great vessels,,Heart
69200,7903y00,atrial inversion op for transposition of great vessels os,,Heart
58886,7903z00,atrial inversion op for transposition of great vessels nos,,Heart
33909,7904000,repositioning of transposed great vessels,,Heart
98383,7904200,left ventricle aorta tunnel right ventricle pul art val con,,Heart
91533,7904300,atrial switch and arterial switch,,Heart
64470,7904y00,other correction of transposition of great vessels os,,Heart
38411,7904z00,other correction of transposition of great vessels nos,,Heart
94475,7905000,correct total anomal pulm venous connect to supracard vessel,,Heart
56741,7905100,correct total anomal pulm venous connect to coronary sinus,,Heart
105154,7905y00,correction of total anomalous pulmonary venous connection os,,Heart
73820,7905z00,correction total anomalous pulmonary venous connection nos,,Heart
73476,7906.11,repair of defect of the atrioventricular septum,,Heart
57102,7906000,close defect atrioventric septum using dual prosthetic patch,,Heart
105465,7906011,rep defect atrioventricular septum dual prosthetic patches,,Heart
39884,7906100,close defect atrioventric septum using prosthetic patch nec,,Heart
95755,7906111,repair defect atrioventricular septum prosthetic patch nec,,Heart
73817,7906200,closure defect atrioventricular septum using tissue graft,,Heart
104708,7906211,repair defect of atrioventricular septum using tissue graft,,Heart
42181,7906300,closure of persistent ostium primum,,Heart
99346,7906311,repair of persistent ostium primum,,Heart
48331,7906400,primary closure of defect of atrioventricular septum nec,,Heart
39885,7906500,revision of closure of defect of atrioventricular septum,,Heart
57270,7906y00,other specified closure of defect of atrioventricular septum,,Heart
38436,7906z00,closure of defect of atrioventricular septum nos,,Heart
88772,7907.11,repair of defect of interatrial septum,,Heart
31101,7907000,closure defect of interatrial septum using prosthetic patch,,Heart
94191,7907011,repair defect of interatrial septum using prosthetic patch,,Heart
43926,7907100,closure defect of interatrial septum using pericardial patch,,Heart
108307,7907111,repair defect of interatrial septum using pericardial patch,,Heart
52287,7907200,closure defect of interatrial septum using tissue graft nec,,Heart
28367,7907300,primary closure of defect of interatrial septum nec,,Heart
102977,7907311,primary repair of defect of interatrial septum nec,,Heart
70424,7907400,revision of closure of defect of interatrial septum,,Heart
67299,7907y00,other specified closure of defect of interatrial septum,,Heart
16191,7907z00,closure of defect of interatrial septum nos,,Heart
91892,7908.11,repair of defect of interventricular septum,,Heart
39803,7908000,close defect interventricular septum using prosthetic patch,,Heart
99781,7908011,repair defect interventricular septum us prosthetic patch,,Heart
50626,7908100,close defect interventricular septum using pericardial patch,,Heart
96130,7908111,repair defect interventricular septum us pericardial patch,,Heart
67483,7908200,close defect interventricular septum using tissue graft nec,,Heart
45358,7908300,primary closure of defect of interventricular septum nec,,Heart
95578,7908311,primary repair of defect of interventricular septum nec,,Heart
105759,7908400,revision of closure of defect of interventricular septum,,Heart
94023,7908500,closure of multiple interventricular septal defects,,Heart
98273,7908511,repair of multiple interventricular septal defects,,Heart
65234,7908600,closure interventricular septal defect us intraop trans pros,,Heart
92020,7908611,repair interventricular septal defect us intraop trans pros,,Heart
57271,7908y00,other specified closure of defect of interventricular septum,,Heart
3864,7908z00,closure of defect of interventricular septum nos,,Heart
86763,7909.11,repair of defect of unspecified septum of heart,,Heart
42090,7909000,closure of defect of heart septum using prosthetic patch nec,,Heart
59012,7909100,closure defect of heart septum using pericardial patch nec,,Heart
28006,7909300,primary closure of defect of septum of heart nec,,Heart
38828,7909y00,other specified closure of defect unspecified heart septum,,Heart
50310,7909z00,closure of defect of unspecified septum of heart nos,,Heart
103939,7909z11,repair of defect of unspecified septum of heart nos,,Heart
36989,790a.00,other open operations on septum of heart,,Heart
68073,790a000,open enlargement of defect of atrial septum,,Heart
31084,790a100,open atrial septostomy,,Heart
36967,790a111,atrial septostomy nec,,Heart
89969,790a200,open atrial septum fenestration,,Heart
67045,790a300,atrial septectomy,,Heart
89333,790a400,atrial septation procedure,,Heart
93264,790a600,surgical atrial septation,,Heart
41085,790ay00,other specified other open operation on septum of heart,,Heart
66308,790az00,other open operation on septum of heart nos,,Heart
49625,790b.00,closed operations on septum of heart,,Heart
28470,790b000,closed enlargement of defect of atrial septum,,Heart
44665,790b011,blalock creation of defect in atrial septum,,Heart
10916,790b012,hanlon creation of defect in atrial septum,,Heart
37452,790b100,closed atrial septostomy,,Heart
47885,790by00,other specified closed operation on septum of heart,,Heart
94040,790bz00,closed operation on septum of heart nos,,Heart
62685,790f.00,refashioning of atrium,,Heart
39029,790f000,correction of persistent sinus venosus,,Heart
44117,790f100,correction of partial anomalous pulmonary venous drainage,,Heart
99829,790f200,repair of cor triatriatum,,Heart
101639,790f300,repair of coronary sinus abnormality,,Heart
105637,790fy00,other specified refashioning of atrium,,Heart
90605,790j.00,other repair of transposition of great arteries,,Heart
95106,790j000,repositioning of transposed great arteries,,Heart
108021,790jz00,other repair of transposition of great arteries nos,,Heart
89231,790k.00,repair of double outlet ventricle,,Heart
107122,790k100,repair of fallot-type double outlet right ventricle,,Heart
98443,790k200,repair of double outlet right ventricle,,Heart
86418,790l.00,transluminal closure of defect of septum,,Heart
89697,790l000,percutan transluminal closure defect intervent sept us pros,,Heart
102523,790l111,percutaneous translum repair defect intervent septum nec,,Heart
102473,790l200,percutan translum closure defect interatr septum us prosth,,Heart
93807,790l300,percutan transluminal closure defect interatrial septum nec,,Heart
106726,790l311,percutan transluminal repair defect interatrial septum nec,,Heart
93953,790l400,percut translum closure defect unspecified septum us prosth,,Heart
99452,790ly00,other specified transluminal closure of defect of septum,,Heart
94982,790lz00,transluminal closure of defect of septum nos,,Heart
97058,790m.00,repair of univentricular heart,,Heart
95444,790m000,total cavopulmonary con extrac inf cav vein pulmon art con,,Heart
91455,790m100,total cavopulmonary connection with lateral atrial tunnel,,Heart
96818,790m200,radical aortopulmonary reconstr systemic-to-pulmon art shunt,,Heart
96637,790m400,biventricular repair of hypoplastic left heart syndrome,,Heart
97825,790m500,takedown of total cavopulmonary connection,,Heart
98899,790m600,conversion atrial pulmonary anastomosis total pulmon connect,,Heart
101844,790m700,aortopulm reconstruct with systemic to pulmon arterial shunt,,Heart
89257,790my00,other specified repair of univentricular heart,,Heart
95951,790mz00,repair of univentricular heart nos,,Heart
91693,790n000,relief of right ventricular outflow tract obstruction,,Heart
103641,790n100,repair of double chambered right ventricle,,Heart
93408,790n400,relief of left ventricular outflow tract obstruction,,Heart
90112,790n500,myectomy of left ventricular outflow tract,,Heart
52608,791a000,infundibulectomy of heart using patch,,Heart
22413,791a100,infundibulectomy of heart nec,,Heart
20940,791a200,repair of subaortic stenosis,,Heart
62293,791a300,repair of supraaortic stenosis,,Heart
91468,791b400,closure of aortic sinus of valsalva fistula,,Heart
91467,791b500,repair of aortic sinus of valsalva aneurysm,,Heart
18903,7927000,repair of arteriovenous fistula of coronary artery,,Heart
48206,7927300,transposition of coronary artery nec,,Heart
93432,792b200,repair of arteriovenous malformation of coronary artery,,Heart
91720,7934700,percutaneous transluminal ablation congenit heart malformat,,Heart
31195,7a0..00,great vessels and pulmonary artery operations,,Heart
100570,7a0..11,great vessel operations,,Heart
91759,7a00.00,open operations for combined abnormality of great vessels,,Heart
56081,7a00000,correction of persistent truncus arteriosus,,Heart
61915,7a00200,repair of hemitruncus arteriosus,,Heart
61794,7a00300,closure of aortopulmonary window,,Heart
94503,7a00400,repair anomalous pulmonary artery origin ascending aorta,,Heart
62845,7a00y00,open operation for combined abnormality of great vessels os,,Heart
97659,7a00z00,open operation for combined abnormality of great vessels nos,,Heart
21090,7a01.00,open correction of patent ductus arteriosus,,Heart
7342,7a01.11,open correction of patent ductus arteriosus (pda),,Heart
50019,7a01000,division of patent ductus arteriosus,,Heart
9573,7a01100,ligation of patent ductus arteriosus,,Heart
36668,7a01200,closure of patent ductus arteriosus nec,,Heart
63163,7a01300,revision of correction of patent ductus arteriosus,,Heart
106081,7a01y00,other specified open correction of patent ductus arteriosus,,Heart
2728,7a01z00,open correction of patent ductus arteriosus nos,,Heart
62356,7a02.00,transluminal operations on abnormality of great vessel,,Heart
12889,7a02000,percut transluminal prosth occlusion patent ductus arterios,,Heart
19188,7a02011,percut translum prosth occlus patent ductus arteriosus (pda),,Heart
85946,7a02100,percutaneous transluminal stent implantation arterial duct,,Heart
65097,7a02y00,transluminal operation on abnormality of great vessel os,,Heart
98952,7a02z00,transluminal operation on abnormality of great vessel nos,,Heart
43683,7a03.00,creation interposition tube prosth shunt aorta to pulm art,,Heart
103793,7a03000,creation interpos tube prosth shunt asc aorta to main pulm a,,Heart
71873,7a03100,create interpos tube prosth shunt asc aorta to right pulm a,,Heart
56170,7a03200,creation interpos tube prosth shunt asc aorta to left pulm a,,Heart
99369,7a03y00,create interpos tube prosth shunt fr aorta to pulm artery os,,Heart
71791,7a03z00,create interpos tube prosth shunt aorta to pulm artery nos,,Heart
68138,7a04.00,other connection from aorta to pulmonary artery,,Heart
70561,7a04000,creation of aortopulmonary window,,Heart
72750,7a04100,creation of anastomosis ascending aorta to main pulm art nec,,Heart
71795,7a04200,creation anastomosis ascending aorta to right pulm art nec,,Heart
56571,7a04211,waterson anastomosis ascending aorta to right pulmonary art,,Heart
68278,7a05.00,create interpos tube prosth shunt subclavian art to pulm art,,Heart
73815,7a05000,create interpos tube prosth shunt r subclavian a to r pulm a,,Heart
99659,7a05100,create interpos tube prosth shunt l subclavian a to l pulm a,,Heart
103332,7a05200,closure prosthetic shunt pulmonary artery subclavian artery,,Heart
56529,7a06.00,other connection from subclavian artery to pulmonary artery,,Heart
73919,7a06000,creation anastomosis right subclav art to right pulm art nec,,Heart
73918,7a06100,creation anastomosis left subclav art to left pulm art nec,,Heart
59428,7a06200,creation anastomosis subclavian artery to pulmonary art nec,,Heart
28104,7a06211,blalock anastomosis of subclavian artery to pulmonary artery,,Heart
40017,7a06212,taussig anastomosis of subclavian artery to pulmonary artery,,Heart
73489,7a06300,revision anastomosis subclavian artery to pulmonary artery,,Heart
91692,7a06500,perc trans ball dilat anas bet pulmon artery subclav artery,,Heart
90852,7a06600,perc translu occlusion anast pulmonary artery subclavian art,,Heart
90119,7a07.00,other connection to pulmonary artery,,Heart
37037,7a07000,creation of anastomosis from vena cava to pulmonary artery,,Heart
52159,7a07011,creation glenn anastomosis from vena cava to pulmonary art,,Heart
96047,7a07y00,other specified other connection to pulmonary artery,,Heart
62255,7a07z00,other connection to pulmonary artery nos,,Heart
42524,7a08200,repair of anomalous pulmonary artery nec,,Heart
73970,7a08300,repair of pulmonary arterial sling,,Heart
37324,7a09000,application of band to pulmonary artery,,Heart
101932,7a09100,adjustment of band to pulmonary artery,,Heart
72797,7a09200,removal of band from pulmonary artery,,Heart
91479,7a09500,pulmonary artery ligation,,Heart
38328,7a0a.00,transluminal operations on pulmonary artery,,Heart
93433,7a0a700,percut transluminal insertion of stent into pulmonary artery,,Heart
59659,7a0ay00,other specified transluminal operation on pulmonary artery,,Heart
34262,7a0az00,transluminal operation on pulmonary artery nos,,Heart
103081,7a0b.00,open operations on both pulmonary arteries,,Heart
99576,7a0c.00,operation on major systemic to pulmonary collateral arteries,,Heart
110194,7a0c000,major systemic to pulmonary collateral artery occlusion,,Heart
96488,7a0c100,pulmonary unifocalisation,,Heart
104062,7a0c400,percut translumin stent major systemic pulmon collateral art,,Heart
66801,7a0y.00,great vessel or pulmonary artery operations os,,Heart
51112,7a0z.00,great vessel and pulmonary artery operations nos,,Heart
92330,7a18111,hamilton repair coarctation of aorta using subclavian flap,,Heart
67046,7a18600,repair of interrupted aortic arch,,Heart
30403,7a61000,excision of congenital arteriovenous malformation,,Other
31174,7a61200,embolisation of arteriovenous abnormality,,Other
64859,7a61300,ligation of congenital arteriovenous malformation,,Other
94806,7a61500,percutan transluminal embolis arteriovenous malformation nec,,Other
89761,7a61600,percut translumin venous embolisat arteriovenous malform,,Other
86587,7a61700,perc translum arterial venous embolis arteriovenous malform,,Other
85997,7a61800,embolisation of arteriovenous abnormality nec,,Other
108804,7a63500,repair of anomalous caval vein connection,,Heart
90121,7a6k000,repair of pulmonary vein stenosis,,Heart
34834,7b01300,heminephrectomy for horseshoe kidney,,Urinary
60919,7b01311,excision of half of horseshoe kidney,,Urinary
34999,7b02000,heminephrectomy for duplex kidney,,Urinary
52671,7b02100,division of isthmus of horseshoe kidney,,Urinary
94128,7b10400,excision of duplex ureter,,Urinary
21797,7b12.00,reimplantation of ureter,,Urinary
42046,7b12000,unspecified bilateral reimplantation of ureter,,Urinary
